id;title;text;date;link;author;hub;topic
1025450;Недельный геймдев: #274 — 19 апреля, 2026;"<img src=""https://habrastorage.org/getpro/habr/upload_files/458/743/a5e/458743a5e04cdbb1d307aa10471320fe.jpg"" /><p>Из <a href=""https://suvitruf.ru/2026/04/20/20007/weekly-gamedev-274-19-april-2026/"" rel=""noopener noreferrer nofollow"">новостей</a>: Phaser 4, продажи Crimson Desert достигли пяти миллионов копий, миллион вишлистов у Replaced, продажи Windrose достигли 1 миллиона копий, страх и ненависть в PIONER.</p><p>Из интересностей: как выпустить инди-новеллу и потратить на это 3 млн рублей, ка";2026-04-20 07:40:12;https://habr.com/ru/articles/1025450/?utm_campaign=1025450&utm_source=habrahabr&utm_medium=rss;Suvitruf;gamedev;игры
1025222;Если Вселенная — симуляция, то квантовая механика — следствие?;"<img src=""https://habrastorage.org/getpro/habr/upload_files/7e6/f12/a25/7e6f12a2556e49108fc6472126ae6b59.jpg"" /><p><strong><em>Квантовая механика как следствие того что мы в симуляции</em></strong><br /><br />Гипотеза о том, что мы живем в симуляции, давно перестала быть уделом одних лишь философов. Сегодня об этом всерьез рассуждают астрофизики и специалисты по теории информации. Но обычно дискуссии сводятся к банальным вещам: пикселям (планковской длине) или ограничениям FPS (планковскому врем";2026-04-19 11:26:41;https://habr.com/ru/articles/1025222/?utm_campaign=1025222&utm_source=habrahabr&utm_medium=rss;mozg4d;gamedev;игры
1024904;Немного про AI для догоняющих;"<img src=""https://habrastorage.org/getpro/habr/upload_files/063/796/949/06379694917e6cd394c5431190cbdc8e.png"" /><p>Если вы слышите слова «промт», «токены» и «MCP‑сервер» и чувствуете лёгкую панику&nbsp;— расслабьтесь, вы не&nbsp;одиноки. Полгода назад мой коллега спросил меня: «А ChatGPT и искусственный интеллект&nbsp;— это одно и то&nbsp;же?». Я начал объяснять, он слушал минуту, потом сказал: «Ладно, просто покажи куда нажимать». Эта статья&nbsp;— для&nbsp;него и для&nbsp;всех, кто чувствует, ";2026-04-18 07:15:30;https://habr.com/ru/articles/1024904/?utm_campaign=1024904&utm_source=habrahabr&utm_medium=rss;Qulisun;gamedev;игры
1022528;Hail to the Rainbow. Разработка игры длиною в вечность. Освещение, лайтмаппинг и приемы оптимизации;"<img src=""https://habrastorage.org/getpro/habr/upload_files/2df/8ff/79a/2df8ff79a40c21c2bc2f3fa261da01bd.jpg"" /><p>Всех приветствую! В прошлом году я начинал цикл статей на тему разработки моей инди – игры Hail to the Rainbow.&nbsp;В данной части речь пойдет о работе с освещением, эффектах и методах оптимизации.</p> <a href=""https://habr.com/ru/articles/1022528/?utm_campaign=1022528&amp;utm_source=habrahabr&amp;utm_medium=rss#habracut"">Читать далее</a>";2026-04-17 13:41:29;https://habr.com/ru/articles/1022528/?utm_campaign=1022528&utm_source=habrahabr&utm_medium=rss;NoskovSS;gamedev;игры
1024590;Запретят ли Steam в РФ, когда выйдет HoMM Olden Era и геймплей «Таркова в космосе»: новости игропрома;"<img src=""https://habrastorage.org/getpro/habr/upload_files/cb4/7fa/a98/cb47faa98c7b8da926dd8feefa9c139e.png"" /><p>Рассказываем, как прошла первая половина апреля 2026 года в русскоговорящей игровой индустрии. В нашем дайджесте вас, как всегда, ждут свежие анонсы, подробности о новых проектах, а также важная информация из пресс-релизов ожидаемых игр.</p> <a href=""https://habr.com/ru/articles/1024590/?utm_campaign=1024590&amp;utm_source=habrahabr&amp;utm_medium=rss#habracut"">Читать далее</a>";2026-04-17 10:24:54;https://habr.com/ru/companies/ggsel/articles/1024590/?utm_campaign=1024590&utm_source=habrahabr&utm_medium=rss;ggsel (ggsel.net);gamedev;игры
1024316;ИИ-шечный мир победил? О влиянии искусственного интеллекта на игропром;"<img src=""https://habrastorage.org/getpro/habr/upload_files/654/0a6/4da/6540a64da813dd1ac1e12f94ad9f474d.jpeg"" /><p>За последние месяцы прогремел целый залп новостей вокруг игровой индустрии и применения нейросетей в создании игр. Геймеры опасаются за судьбу игропрома, который как будто переходит под власть бездушного Скайнета, ревностно ищут следы ИИ в анонсируемых играх. Ну а работники игропрома, естественно, встревожены куда сильнее - для них будущее индустрии напрямую определяет карьерные пе";2026-04-16 14:48:38;https://habr.com/ru/companies/ggsel/articles/1024316/?utm_campaign=1024316&utm_source=habrahabr&utm_medium=rss;ggsel (ggsel.net);gamedev;игры
1023806;[Перевод] Сегодня я узнал нечто новое о GPU благодаря багу в своей игре;"<img src=""https://habrastorage.org/getpro/habr/upload_files/685/845/ccd/685845ccd31a0420b704604aef500f2d.jpg"" /><p>Я только что выпустил обновление моей игры Blackshift, в котором, среди прочего, были добавлены эти тайлы песка:</p><p>Всё было хорошо, пока не начали поступать отчёты о багах.</p><p>Попрощавшись со спокойным завершением вечера, я начал думать, в чём же могла быть причина.</p> <a href=""https://habr.com/ru/articles/1023806/?utm_campaign=1023806&amp;utm_source=habrahabr&amp;utm_medium";2026-04-15 12:23:57;https://habr.com/ru/articles/1023806/?utm_campaign=1023806&utm_source=habrahabr&utm_medium=rss;PatientZero;gamedev;игры
1023334;Компиляторы тоже путаются в именах;"<img src=""https://habrastorage.org/getpro/habr/upload_files/168/85b/8d6/16885b8d661e8408ec08f4567c81523a.png"" /><p>Это продолжение темы начатой в статье <a href=""https://habr.com/ru/articles/990816/"" rel=""noopener noreferrer nofollow"">Важны ли компилятору имена</a>,  и продолженой в <a href=""https://habr.com/ru/articles/1015492/"" rel=""noopener noreferrer nofollow"">Ночью все кошки серы, а using'и одинаковы</a>, и если вам нужна полная картина, как компилятор превращает текст в программу, то без п";2026-04-14 11:53:35;https://habr.com/ru/articles/1023334/?utm_campaign=1023334&utm_source=habrahabr&utm_medium=rss;dalerank;gamedev;игры
1023308;Каким будет новый Xbox (Project Helix);"<img src=""https://habrastorage.org/getpro/habr/upload_files/39a/a8a/f31/39aa8af312b646d961846f818bb4b59b.jpeg"" /><p>Осенью 2024-го Microsoft <a href=""https://www.youtube.com/watch?v=IYBSNQLsBKk"">запустила</a> маркетинговую кампанию This is an Xbox. По задумке пользователям не нужна была, собственно, приставка, чтобы опробовать игры бренда — вместо этого компания предлагала облачный гейминг на теликах, планшетах, телефонах и прочем.&nbsp;</p><p>Идейная вдохновительница концепции, тогда еще операц";2026-04-14 11:16:29;https://habr.com/ru/companies/ggsel/articles/1023308/?utm_campaign=1023308&utm_source=habrahabr&utm_medium=rss;ggsel (ggsel.net);gamedev;игры
1015522;Как дела в коммерческом геймдеве в 2026 году;"<img src=""https://habrastorage.org/getpro/habr/upload_files/ed8/f43/aa0/ed8f43aa0a989e6158bab33f5f241e83.png"" /><p>Привет, Хабр! Сегодня поговорим о современном геймдеве, причём не просто играх, а именно коммерческой разработке (и что там происходит).</p><p>Меня зовут Валерий Линьков, я  вернулся на «Хабр», но уже как автор и наставник на курсах Яндекс Практикума. Настало время снова поговорить об играх и геймдеве в целом.</p><p>Раньше, игры были бунтом общества 70-80-ых годов, затем в девяносты";2026-04-14 06:02:43;https://habr.com/ru/companies/yandex_praktikum/articles/1015522/?utm_campaign=1015522&utm_source=habrahabr&utm_medium=rss;valerylinkov (Яндекс Практикум);gamedev;игры
1022950;Как стать инди-разработчиком в 40+ лет без опыта и образования;"<img src=""https://habrastorage.org/getpro/habr/upload_files/7cd/42c/683/7cd42c683000bb09f31a167d69498edd.jpg"" /><p>В этом посте я хочу поделиться своим мнением: может&nbsp;ли человек в 2026 году без специализированного образования и без какого-либо опыта в геймдеве стать инди-разработчиком.</p><p>Меня зовут Rok и в настоящее время я занимаюсь разработкой коллекционной карточной игры про танки в сеттинге Второй мировой войны&nbsp;— Tank General.</p><p>На данный момент мне 44 года. Я не являюсь пр";2026-04-13 14:15:49;https://habr.com/ru/articles/1022950/?utm_campaign=1022950&utm_source=habrahabr&utm_medium=rss;RokDooM;gamedev;игры
1022672;Недельный геймдев: #273 — 12 апреля, 2026;"<img src=""https://habrastorage.org/getpro/habr/upload_files/fcb/ccb/f5e/fcbccbf5e48bd66b814d9f98d0fe2b2d.jpeg"" /><p>Из <a href=""https://suvitruf.ru/2026/04/12/19965/weekly-gamedev-273-12-april-2026/"" rel=""noopener noreferrer nofollow"">новостей</a>: Epic Games работает над игрой с персонажами Disney, GFA Games в кризисе, общие продажи игр Hazelight Studios превысили 50 млн копий, продажи Road to Vostok достигли 100 тысяч копий, Playtika могут выставить на продажу.</p><p>Из интересностей: Павел Сн";2026-04-13 07:05:41;https://habr.com/ru/articles/1022672/?utm_campaign=1022672&utm_source=habrahabr&utm_medium=rss;Suvitruf;gamedev;игры
1020944;Как ИИ убивает игровую индустрию (и не только её);"<img src=""https://habrastorage.org/getpro/habr/upload_files/3af/346/dfd/3af346dfd18042f679d03410c0aeb707.webp"" /><p>2025 год кончился тем, что оперативная память, SSD-накопители и даже старые добрые жёсткие диски теперь стоят как крыло самолёта. Причина — корпорации, которые сделали ставку на ИИ и создают ИИ-продукты, в огромных количествах закупаясь памятью для ЦОДов. Подорожало абсолютно всё — как комплектующие для ПК, так и игровые консоли. Искусственный интеллект повлиял не только на цены, н";2026-04-12 13:01:22;https://habr.com/ru/companies/ruvds/articles/1020944/?utm_campaign=1020944&utm_source=habrahabr&utm_medium=rss;Guren302 (RUVDS.com);gamedev;игры
1021990;Ностальгические игры: Homeworld;"<img src=""https://habrastorage.org/getpro/habr/upload_files/bef/50d/84a/bef50d84a7307ffb83badae315d1bde6.jpg"" /><p>Homeworld — из тех игр, что запоминаются не только механиками или сюжетом, а каким-то трудноуловимым настроением. Не только из-за космоса, кораблей и впечатляющих битв, а из-за редкого для того времени ощущения настоящего масштаба. Она не старалась брать игрока напором, бесконечным экшеном или пёстрой зрелищностью, вместо этого перед тобой раскрывалась холодная и почти пугающая пуст";2026-04-12 07:05:58;https://habr.com/ru/companies/timeweb/articles/1021990/?utm_campaign=1021990&utm_source=habrahabr&utm_medium=rss;OldfagGamer (Timeweb Cloud);gamedev;игры
1022412;Идеальный Outline в Unity 6: Пишем эффект обводки под новый URP Render Graph;"<img src=""https://habrastorage.org/getpro/habr/upload_files/5e7/322/206/5e7322206f8ff0085d892a3d0a1de567.gif"" /><p>Если вы недавно обновились до Unity 6 (или URP 17+) и попытались перенести свои старые пост-эффекты, то наверняка столкнулись с красной консолью и предупреждениями об устаревших методах.</p><p>Старые туториалы по созданию эффекта обводки (Outline) через <code>ScriptableRendererFeature</code> больше не работают ""из коробки"". Unity полностью изменила архитектуру рендера, внедрив <stro";2026-04-12 05:18:28;https://habr.com/ru/articles/1022412/?utm_campaign=1022412&utm_source=habrahabr&utm_medium=rss;AlexeyNazariev;gamedev;игры
1025256;Мобильная разработка за неделю #628 (13 — 19 апреля);"<img src=""https://habrastorage.org/getpro/habr/upload_files/f0a/b9e/5f4/f0ab9e5f40587b468c9b220e52878ac0.jpg"" /><p>В этом выпуске сравнение быстродействия SwiftUI и UIKit, план изучения Android-разработки и Kotlin DSL для Android-шейдеров, прагматичный взгляд на архитектуру Flutter и пара детективов с поиском багов, как не надо делать скриншоты в App Store, диспетчеризация дома, поддержка Swift в разных IDE, тестирование взаимодействия нескольких устройств и многое другое. Заходите!</p> <a href=";2026-04-19 13:04:38;https://habr.com/ru/articles/1025256/?utm_campaign=1025256&utm_source=habrahabr&utm_medium=rss;RoboForm;mobile_dev;игры
1024896;Фильтр Калмана, geohash fog of war и три реджекта Apple: как я собрал GPS-трекер на SwiftUI;"<img src=""https://habrastorage.org/getpro/habr/upload_files/7d8/958/7c7/7d89587c76994a689ca6c9cefec884fe.PNG"" /><p>В 2024 году Google тихо убил Timeline в Google Maps. Историю местоположений перевели в «локальный режим», который на практике работает через раз - данные теряются, синхронизации нет, а у многих просто исчезли годы накопленной истории.</p><p>Для меня это было важно: я много езжу на машине и хотел знать простую вещь - сколько конкретная поездка стоит в бензине. Ничего подходящего не н";2026-04-18 05:40:56;https://habr.com/ru/articles/1024896/?utm_campaign=1024896&utm_source=habrahabr&utm_medium=rss;OneZee;mobile_dev;игры
1023828;Продолжаем приручать ИИ: рефлексия агента, интервью пользователя, God agent;"<img src=""https://habrastorage.org/getpro/habr/upload_files/091/fa3/db2/091fa3db2642380a1ce50c5719d0cdd9.jpg"" /><p><br />В последнее время в нашем любимом ИТ всё меняется слишком быстро. Причина тому — генеративные языковые модели. Новые знания становятся deprecated спустя несколько месяцев. Вчерашние революционные подходы сегодня выглядят как рудимент. Есть один большой плюс такой тенденции: если вы вдруг проспали старт ИИ-гонки, наверстать упущенное и догнать лидеров можно достаточно быстро.<b";2026-04-17 09:00:32;https://habr.com/ru/companies/wildberries/articles/1023828/?utm_campaign=1023828&utm_source=habrahabr&utm_medium=rss;Ales_Ivanov (Wildberries & Russ);mobile_dev;игры
1023412;Как филолог сделал приложение. Первый опыт;"<img src=""https://habrastorage.org/getpro/habr/upload_files/204/6d5/79d/2046d579d49d6b73001214915d85a79a.png"" /><p>Приветствую, уважаемые читатели данной статьи! Сорри за кликбейт в заголовке, но, сами понимаете, такие времена. Тем не менее, доля правды в нём была. В своё время мне удалось окончить филфак, однако последние 5+ лет занимаюсь маркетингом.</p><p>О чём эта статья? О моём первом опыте разработки Android-приложения с помощью чата GPT, взлётах и падениях морального состояния, а также ин";2026-04-14 13:21:58;https://habr.com/ru/articles/1023412/?utm_campaign=1023412&utm_source=habrahabr&utm_medium=rss;SerjBar;mobile_dev;игры
1023352;Anubis: заморозка приложений по состоянию VPN;"<img src=""https://habrastorage.org/getpro/habr/upload_files/14f/183/802/14f183802369b8f842fcb9e5ddf286fc.png"" /><p>Приложения на вашем телефоне могут обнаружить VPN через SOCKS5 на localhost и слить IP-адрес сервера. Рабочий профиль (Island, Insular, Shelter) скрывает VPN от  ConnectivityManager, но не от tun0, маршрутов и локальных портов. Так родился open-souce Anubis, который решает проблему иначе - автоматически отключает приложения через pm disable-user при смене состояния VPN. Мёртвое прил";2026-04-14 12:17:23;https://habr.com/ru/articles/1023352/?utm_campaign=1023352&utm_source=habrahabr&utm_medium=rss;sogonov;mobile_dev;игры
1022782;Пара детективов с поиском багов в мобильных приложениях банков;"<img src=""https://habrastorage.org/getpro/habr/upload_files/c8b/0dc/1f0/c8b0dc1f090e403525d7f0dd36992f4c.png"" /><p>Пока оперативка дорожает из-за LLM, в банках очень много ручного тестирования. Покрытие автотестами не очень высокое, потому что их тоже надо писать с AI, а ИБ закономерно запрещает доступ к внешним облачным моделям. Мы не можем просто взять закрытый код банка и скормить его публичной нейросети.</p><p>По большей части на ручные тесты уезжают сверка логики процесса (end-to-end-сценар";2026-04-14 11:01:16;https://habr.com/ru/companies/centicore_group/articles/1022782/?utm_campaign=1022782&utm_source=habrahabr&utm_medium=rss;xForeYx (Centicore Group);mobile_dev;игры
1023082;ИИ-аватар по фото бесплатно: создаю говорящее видео из фотографии в Telegram за 2 минуты;"<p>Загружаешь фото, пишешь текст — через 2 минуты бот в Telegram присылает видео, где человек на фото произносит этот текст. Сделал бота AvatarBox на HeyGen API. Рассказываю пошагово: как подготовить фото, написать текст, выбрать голос, и для каких задач это реально полезно — видеовизитки, презентации, контент без показа лица. И что не работает: длинные видео, жесты, песни.</p> <a href=""https://habr.com/ru/articles/1023082/?utm_campaign=1023082&amp;utm_source=habrahabr&amp;utm_medium=rss#habracu";2026-04-13 22:02:12;https://habr.com/ru/articles/1023082/?utm_campaign=1023082&utm_source=habrahabr&utm_medium=rss;nlaik;mobile_dev;игры
1023006;Сделал MVP за 3 дня, а потом неделю прикручивал оплату. Оно того стоило?;"<img src=""https://habrastorage.org/getpro/habr/upload_files/8ae/ee3/6dc/8aeee36dcdde6e50cbdf106ab449abd4.jpg"" /><p>Как лучше запускать MVP — сразу с платной функциональностью или сначала сделать все бесплатным и собрать фидбек? Рассказываю, как это было у меня.</p> <a href=""https://habr.com/ru/articles/1023006/?utm_campaign=1023006&amp;utm_source=habrahabr&amp;utm_medium=rss#habracut"">Читать далее</a>";2026-04-13 16:11:49;https://habr.com/ru/articles/1023006/?utm_campaign=1023006&utm_source=habrahabr&utm_medium=rss;vital_pavlenko;mobile_dev;игры
1022756;Книга про разработку под iOS на русском: разбираем единственный актуальный учебник по SwiftUI;"<img src=""https://habrastorage.org/getpro/habr/upload_files/30a/9cf/61d/30a9cf61db32f7c00ffca39d9b3da2d9.jpg"" /><p>Если набрать в поиске «книга по SwiftUI на русском», результаты будут неожиданно скромными. Такие издания есть, но они либо выпущены уже довольно давно (как, например, <a href=""https://bhv.ru/product/razrabotka-prilozhenij-na-swift-i-swiftui-s-nulya-2-e-izdanie/"">наша книга Александра Казанцева</a>, либо представлены на английском, либо доступны в формате он-лайн курсов разной степе";2026-04-13 09:34:06;https://habr.com/ru/companies/bhv_publishing/articles/1022756/?utm_campaign=1022756&utm_source=habrahabr&utm_medium=rss;BHV_publishing (Издательство БХВ);mobile_dev;игры
1022546;Маяк в пустыне: Kotlin DSL для Android-шейдеров;"<img src=""https://habrastorage.org/getpro/habr/upload_files/c1d/c63/2ef/c1dc632ef842855ba7ddda531930e820.jpg"" /><p>Когда я впервые всерьёз сел писать AGSL под Android, ощущение было очень странное. С одной стороны - современный графический конвейер,&nbsp;<code>RuntimeShader</code>,&nbsp;<code>RenderEffect</code>, красивые эффекты и весь этот техно-киберпанк. С другой - шейдерный код живёт внутри строковых литералов,&nbsp;<code>uniform</code>-ы приходится объявлять и привязывать вручную, а отладк";2026-04-12 14:31:17;https://habr.com/ru/articles/1022546/?utm_campaign=1022546&utm_source=habrahabr&utm_medium=rss;red-byte;mobile_dev;игры
