id;title;text;date;link;author;hub;topic
1022510;Мобильная разработка за неделю #627 (6 — 12 апреля);"<img src=""https://habrastorage.org/getpro/habr/upload_files/96f/392/f8a/96f392f8a05655892e25efa1da5c0c2d.jpg"" /><p>В новом дайджесте пружинная анимация и Kotlin без «воды, будущее Android-приложений с AppFunctions и путь к сингулярности, лампа с цифровым джинном, как Gemma 4 меняет правила игры, ошейники для коров, замена List, Remote Compose и многое другое. Заходите!</p> <a href=""https://habr.com/ru/articles/1022510/?utm_campaign=1022510&amp;utm_source=habrahabr&amp;utm_medium=rss#habracut"">Чи";2026-04-12 12:42:45;https://habr.com/ru/articles/1022510/?utm_campaign=1022510&utm_source=habrahabr&utm_medium=rss;RoboForm;mobile_dev;игры
1022422;Критическая уязвимость VLESS клиентов? Подержите мое пиво…;"<img src=""https://habrastorage.org/getpro/habr/upload_files/4ba/ab1/485/4baab1485d336f8455cba15897a64743.png"" /><p>Приветствую тебя, %USERNAME%! Ох и давно я не писал ничего на Хабр (10+ лет) — чернила высохли, перо затупилось. И все же, читая последние сводки, мой академический интерес проснулся.</p><p>Если вдруг пропустили и не понимаете о чем я, то информационный фон сейчас бурлит: тут и новости про то, как <a href=""https://habr.com/ru/news/1021908/"" rel=""noopener noreferrer nofollow"">большин";2026-04-12 11:55:13;https://habr.com/ru/articles/1022422/?utm_campaign=1022422&utm_source=habrahabr&utm_medium=rss;Wendor;mobile_dev;игры
1021162;[Перевод] Как я с помощью автоматизации выиграл iPhone от McDonald’s;"<img src=""https://habrastorage.org/getpro/habr/upload_files/5c4/82c/591/5c482c591605f659580f4a83a66168e8.png"" /><p>Несколько лет назад сеть McDonald проводила промо-акцию, в которой через простую мини-игру можно было выиграть iPhone. Называлась эта игра «FriesHit» и была доступна в мобильном приложении McDonald’s (бельгийская версия). Это просто примитивная тапалка, целью которой являлось занять первую строчку таблицы лидеров, чтобы заполучить заветный iPhone (или Samsung S10, если вы окажетесь ";2026-04-10 13:01:55;https://habr.com/ru/companies/ruvds/articles/1021162/?utm_campaign=1021162&utm_source=habrahabr&utm_medium=rss;Bright_Translate (RUVDS.com);mobile_dev;игры
1021790;FiT календарь тренировок — финал трилогии пет-проекта;"<img src=""https://habrastorage.org/getpro/habr/upload_files/0a0/50e/8d4/0a050e8d46b975aba4883f0cfde56f1c.jpg"" /><p>Год назад я опубликовал <a href=""https://habr.com/ru/articles/895296/"" rel=""noopener noreferrer nofollow"">первую статью</a> про разработку приложения календаря тренировок. Спустя 5 месяцев опубликовал <a href=""https://habr.com/ru/articles/943834/"" rel=""noopener noreferrer nofollow"">рассказ о 10 обновлениях</a>. Сейчас время финала истории - ещё 7 обновлений за 7 месяцев.</p><p>Сам р";2026-04-10 10:20:07;https://habr.com/ru/articles/1021790/?utm_campaign=1021790&utm_source=habrahabr&utm_medium=rss;dergunovs;mobile_dev;игры
1021726;Kotlin без «воды»: новая книга для тех, кто хочет изучить язык на практике;"<img src=""https://habrastorage.org/getpro/habr/upload_files/b99/130/b7a/b99130b7aa3e367a43e5121ae015dadc.jpg"" /><p>Некоторые языки программирования начинают по-настоящему ценить тогда, когда разработчик замечает: значительная часть усилий уходит на решение задачи, а не на борьбу с инструментом. Экосистема Java — хороший пример такого накопленного трения. Она несет в себе наследие решений, принятых десятилетия назад, притом они не обязательно плохие — просто раньше не учитывались те сценарии, кот";2026-04-10 09:00:58;https://habr.com/ru/companies/bhv_publishing/articles/1021726/?utm_campaign=1021726&utm_source=habrahabr&utm_medium=rss;BHV_publishing (Издательство БХВ);mobile_dev;игры
1019246;Да кто такие эти ваши Fissure, почему интернет обсуждает проблемы турнирного оператора;"<img src=""https://habrastorage.org/getpro/habr/upload_files/259/eb4/ae3/259eb4ae3e977a55423ab5e94d1725ac.jpeg"" /><p>Мир киберспорта обширен, регулярно проводятся соревнования по различным, любимым многими, дисциплинам. Сегодня качественный онлайн продакшн в тематической студии, красивая графика эфира и, даже, оффлайн этапом на крупных площадках стали нормой для крупных турниров. Но кто организует эти турниры?</p> <a href=""https://habr.com/ru/articles/1019246/?utm_campaign=1019246&amp;utm_source=";2026-04-04 12:39:19;https://habr.com/ru/articles/1019246/?utm_campaign=1019246&utm_source=habrahabr&utm_medium=rss;Terrapard;cybersport;игры
1017722;Как скуф ходил на первый в России Суперкубок Медиа Кибер Лиги;"<img src=""https://habrastorage.org/getpro/habr/upload_files/3a1/4f1/6c1/3a14f16c11bce06b4b918bd9893c541b.jpg"" /><p>Привет, Хабр! В&nbsp;Москве 21&nbsp;и 22&nbsp;марта 2025&nbsp;года прошёл в&nbsp;Международном центре бокса первый <a href=""https://habr.com/ru/news/1012820/"" rel=""noopener noreferrer nofollow"">Суперкубок</a> Медиа Кибер&nbsp;Лиги. И меня позвала Федерация Компьютерного Спорта России посмотреть это киберспортивное соревнование. Вообще, я зарёкся ходить на&nbsp;киберспортивные турнир";2026-03-31 20:49:38;https://habr.com/ru/articles/1017722/?utm_campaign=1017722&utm_source=habrahabr&utm_medium=rss;Lexx_Nimofff;cybersport;игры
1009386;Устранение всех ошибок FACEIT Anti-Cheat: Подробный гайд 2026;"<img src=""https://habrastorage.org/getpro/habr/upload_files/3cc/053/895/3cc053895c725cace58e7a4484651944.png"" /><p>Защита от читеров в киберспорте сильно шагнула вперед. Если раньше античиты работали как обычные приложения и просто поверхностно проверяли память компьютера, то теперь они встраиваются в самые глубины Windows (на уровень ядра) и работают напрямую с железом.</p><p>Вот как это можно описать простыми словами на примере FACEIT Anti-Cheat, одного из самых строгих античитов на сегодня.</";2026-03-12 10:21:37;https://habr.com/ru/companies/paybeam/articles/1009386/?utm_campaign=1009386&utm_source=habrahabr&utm_medium=rss;Paybeam (Paybeam);cybersport;игры
1003366;Великая киберспортивная афера: как нас всех возможно обманывают;"<img src=""https://habrastorage.org/getpro/habr/upload_files/454/7a1/e4e/4547a1e4e8adba58bec985e8ed7939d4.jpg"" /><p>Киберспорт далеко не сразу начали воспринимать всерьёз.</p><p>Долгое время его считали развлечением, хобби — чем угодно, но только не спортом.</p><p>Сегодня же это полноценная индустрия с многомиллионными призовыми, контрактами и спонсорами.</p><p>И, к сожалению, вместе с ростом пришли и старые проблемы.</p><p>Киберспорт унаследовал все грехи большого спорта.</p><p>В том числе — доп";2026-02-25 07:11:25;https://habr.com/ru/articles/1003366/?utm_campaign=1003366&utm_source=habrahabr&utm_medium=rss;DazzleBizzareAdventure;cybersport;игры
962476;Киберспорт: что нужно, чтобы стать профессионалом;"<img src=""https://habrastorage.org/getpro/habr/upload_files/dfc/f30/cbe/dfcf30cbe6aec22fb10f81609e1feebb.jpg"" /><p>Киберспорт сегодня на подъеме: в индустрию вкладывают деньги инвесторы, постоянно проходят чемпионаты среди школьников и студентов, а сериалы вроде «Хэдшот» или «Киберпапа» добавляют романтики.&nbsp;</p><p>Но за глянцевой обложкой скрываются суровые реалии — с ними человек сталкивается сразу же после того, как киберспорт перерастает хобби. Несколько лет назад о них мне рассказали ка";2025-11-08 07:00:20;https://habr.com/ru/companies/ru_mts/articles/962476/?utm_campaign=962476&utm_source=habrahabr&utm_medium=rss;ivansychev (МТС);cybersport;игры
957858;Как мы устроили Wi-Fi хакинг‑баттл для студентов IT-вуза: кейс необычного чемпионата по обучению wireless технологиям;"<img src=""https://habrastorage.org/getpro/habr/upload_files/db3/cb8/acd/db3cb8acdab9c627c96704aad2b78771.jpg"" /><p>Привет, Хабр! Меня зовут Алексей, и я занимаюсь беспроводными технологиями. В апреле этого года мне посчастливилось принять участие в организации образовательного мероприятия для студентов Томского государственного университета систем управления и радиоэлектроники. Мы смогли придумать новый формат, сочетающий программирование, спортивные соревнования на время, исследования в области";2025-10-19 11:44:24;https://habr.com/ru/articles/957858/?utm_campaign=957858&utm_source=habrahabr&utm_medium=rss;GrekNirvana;cybersport;игры
942084;Эмоции и шахматы: как психоэмоциональные паттерны влияют на исход партий;"<img src=""https://habrastorage.org/getpro/habr/upload_files/566/534/25d/56653425d54582121b06951e61323b47.png"" /><p>Шахматы — это не просто игра, а сложный интеллектуальный процесс, где каждый ход отражает не только стратегическое мышление, но и эмоциональное состояние игрока. В эпоху искусственного интеллекта и больших данных мы стоим на пороге новой эры анализа шахматных партий, где психоэмоциональные паттерны становятся ключом к пониманию и предсказанию исходов.</p><p>Проект, представляемый зд";2025-08-29 12:42:23;https://habr.com/ru/articles/942084/?utm_campaign=942084&utm_source=habrahabr&utm_medium=rss;mmmc;cybersport;игры
936310;Как я создал компьютерный класс в психоневрологическом интернате;<p>В мире IT мы привыкли говорить о высоких технологиях, новейших фреймворках и многомиллиардных стартапах. Но сегодня я хочу рассказать о проекте, который далек от этого мира. О проекте, который не принесет прибыли, не получит инвестиций, но зато подарит радость и новые возможности людям, оторванным от общества. Я работаю психологом в психоневрологическом интернате, где проживает около 500 человек преимущественно мужского пола. Далеко не все из них могут пользоваться компьютером, но в отделении;2025-08-12 10:16:52;https://habr.com/ru/articles/936310/?utm_campaign=936310&utm_source=habrahabr&utm_medium=rss;ecaucs;cybersport;игры
925096;Киберклубы в условиях санкций: импортозамещение, ПО для киберарен и адаптация к новым экономическим реалиям;"<img src=""https://habrastorage.org/getpro/habr/upload_files/811/ea6/964/811ea69645742497aa03731b7d96b1bc.jpg"" /><p>Мысль написать этот материал появилась на конференции компании Langame. Сейчас киберклубы, или киберарены, переживают новый всплеск популярности. Киберспорт тоже стал более востребованным, потому что соревновательный и спортивный опыт кибератлеты получают в том числе и в киберклубах. Однако я уже пообщался с разными киберспортсменами, поэтому хочу теперь поговорить с функционерами к";2025-07-04 15:27:35;https://habr.com/ru/articles/925096/?utm_campaign=925096&utm_source=habrahabr&utm_medium=rss;Lexx_Nimofff;cybersport;игры
924348;Cherry MX — опыты на людях;"<img src=""https://habrastorage.org/getpro/habr/upload_files/7a4/e7b/b4c/7a4e7bb4c67e678bd799a2ca145232cc.png"" /><p>В эксперименте участвовали 33 человека, которые печатали тексты на клавиатурах с разными типами свитчей Cherry MX (Red, Black, Brown и Blue) и состояниями подсветки (вкл/выкл). Измеряли скорость и точность печати, а также субъективные впечатления пользователей по шкале Лайкерта. Посмотрим, удалось ли найти закономерности и в чью пользу сработали цифры.</p> <a href=""https://habr.com/";2025-07-04 05:00:56;https://habr.com/ru/articles/924348/?utm_campaign=924348&utm_source=habrahabr&utm_medium=rss;mishkamix;cybersport;игры
923574;Факторы становления профессионального киберспортсмена: анализ внутренних и внешних условий для достижения успеха;"<img src=""https://habrastorage.org/getpro/habr/upload_files/82c/335/55c/82c33555c376d709e80e4e5e96fa526e.png"" /><p>Количество игр, разнообразие дисциплин растёт с каждым годом, в результате чего растёт и количество желающих попасть в киберспорт. Для начинающих игроков и людей, которые застопорились в своём развитии как игрока, мы выделили внутренние и внешние факторы, влияющие на становление профессионального киберспортсмена и составили из них руководство, которым могут пользоваться как люди, же";2025-06-30 17:11:02;https://habr.com/ru/articles/923574/?utm_campaign=923574&utm_source=habrahabr&utm_medium=rss;Katyadra;cybersport;игры
914316;Обзор интерактивной выставки «Спорт будущего в настоящем» в Государственном музее спорта;"<img src=""https://habrastorage.org/getpro/habr/upload_files/571/cb2/65c/571cb265c29c98f53e1919393a029d2c.jpg"" /><p>Как&nbsp;я уже говорил, я буду продолжать рассказывать о&nbsp;киберспорте и смежных видах спора. Внезапно я узнал о&nbsp;выставке, посвящённой молодым видам спорта, в&nbsp;<a href=""https://museumsport.ru/"" rel=""noopener noreferrer nofollow"">Государственном музее спорта</a>. Поскольку выставка&nbsp;была связана не&nbsp;только с&nbsp;компьютерным спортом, но&nbsp;и с&nbsp;другими вида";2025-05-30 11:46:27;https://habr.com/ru/articles/914316/?utm_campaign=914316&utm_source=habrahabr&utm_medium=rss;Lexx_Nimofff;cybersport;игры
901998;Девайсы киберспортсменов: на чем играют победители;"<img src=""https://habrastorage.org/getpro/habr/upload_files/f54/66e/22a/f5466e22a9380d62fd3370f1edded683.jpeg"" /><p>Киберспорт - одна из любимых корпоративных активностей в&nbsp;ЛАНИТ. У&nbsp;нас есть <a href=""https://www.lanit.ru/projects/razvitie-kibersportivnogo-soobshchestva-v-lanit/"">крутое сообщество</a>, участники которого постоянно выступают на&nbsp;соревнованиях и нередко становятся их победителями и призерами. Для&nbsp;успешных состязаний на&nbsp;турнирах игроки уделяют большое внимани";2025-05-06 07:00:28;https://habr.com/ru/companies/lanit/articles/901998/?utm_campaign=901998&utm_source=habrahabr&utm_medium=rss;Anastasiya_Shurkaeva (ГК ЛАНИТ);cybersport;игры
906122;Взгляд на мобильный киберспорт от скуфа и беседа с прокиберспорсменом Lunax (Virtus.pro);"<img src=""https://habrastorage.org/getpro/habr/upload_files/2f5/038/d53/2f5038d53ce0b69cf9d999154e8d0ce8.jpg"" /><p>Этим материалом я заканчиваю серию интервью с&nbsp;киберспортсменами. Нет, это не&nbsp;значит, что&nbsp;их больше совсем не&nbsp;будет, но&nbsp;рассказать что‑то новое о&nbsp;киберспорте в&nbsp;лицах становится всё сложнее&nbsp;— как&nbsp;и разговорить спортсмена, если ты не&nbsp;профильный журналист и не&nbsp;пишешь для&nbsp;специализированного издания.</p><p>У&nbsp;меня&nbsp;были ";2025-04-30 18:41:19;https://habr.com/ru/articles/906122/?utm_campaign=906122&utm_source=habrahabr&utm_medium=rss;Lexx_Nimofff;cybersport;игры
901826;Dota 2, киберспорт, спортзал и жизнь вне игры. Интервью с киберспортсменом Ильёй Spirit Тереховым;"<img src=""https://habrastorage.org/getpro/habr/upload_files/1f3/70d/64f/1f370d64fbefc32988019b0a021747f1.png"" /><p>Я продолжаю описывать портрет современного геймера&nbsp;— тем более, повод соответствующий: недавно я <a href=""https://habr.com/ru/news/900494/"" rel=""noopener noreferrer nofollow"">посетил</a> Школьную&nbsp;Лигу «Сбера», где&nbsp;было целых пять дисциплин&nbsp;— «Электронные шахматы», Tetris, «Мир Танков», «Поиск в&nbsp;интернете» и Dota 2.</p><p>Поскольку две из&nbsp;этих дисциплин&";2025-04-17 14:04:22;https://habr.com/ru/articles/901826/?utm_campaign=901826&utm_source=habrahabr&utm_medium=rss;Lexx_Nimofff;cybersport;игры
