id;text;date;likes;reposts;comments;views;url;topic
-15755094_48295538;"РИА Новости теперь в MAX!

Мы в центре событий, чтобы вы были в курсе. А теперь вы можете получать главные новости еще быстрее в нашем канале в MAX. Там вас ждут: 

— Срочные сообщения
— Свежие подробности 
— Авторские материалы
— Репортажи наших корреспондентов
— Эксклюзивные видео и инфографика

Все это — уже в вашей ленте. Оперативно. Точно. Достоверно.

Подписывайтесь на РИА Новости в MAX: https://max.ru/ria";2025-07-22 12:42:18;1758;260;126;9388144;https://vk.com/wall-15755094_48295538;новости
-15755094_49949425;"Финн поставил на участке чучело Стубба.
 
Мужчина выпилил из дерева полноразмерную фигуру финского президента. Теперь чучело находится на участке и «вполне хорошо» отпугивает птиц, сообщает газета Ilta-Sanomat.
 
Автор также выставил свое творение на продажу и надеется, что Стубб увидит «скульптуру».
https://vk.cc/cWUFrw";2026-04-20 17:43:14;32;5;13;4757;https://vk.com/wall-15755094_49949425;новости
-15755094_49949300;"Суд заочно приговорил рэпера-иноагента Моргенштерна к штрафу в семь миллионов рублей.
https://vk.cc/cWUzPF";2026-04-20 17:09:21;65;3;34;10134;https://vk.com/wall-15755094_49949300;новости
-15755094_49949186;"Росавиация отменила ограничения на полеты в ОАЭ и через воздушное пространство Ирана, сообщили в Минтрансе.
https://vk.cc/cWUtX8";2026-04-20 16:35:01;43;11;2;19969;https://vk.com/wall-15755094_49949186;новости
-15755094_49949046;"Налетчики прокопали 12-метровый тоннель, чтобы ограбить банк в Неаполе 
 
«Требовалось несколько недель работы. Его копали вручную без использования техники, чтобы не привлекать внимание, возможно, саперными лопатками и граблями», — рассказал РИА Новости геолог Джанлука Минин. 
 
В четверг преступники ворвались в банк, разграбили 40 ячеек для хранения ценностей и скрылись, их до сих пор не поймали.";2026-04-20 16:00:25;84;34;23;17125;https://vk.com/wall-15755094_49949046;новости
-15755094_49949045;"Апрельский снег выпал в центральной России из-за активного циклона. 
 
В Рязанской области высота снежного покрова достигала 12 сантиметров, сообщил синоптик Леус в Telegram-канале. 
 
«Осадки будут ухудшать видимость, на дорогах и тротуарах станет скользко», — добавил он.";2026-04-20 16:00:01;44;29;7;12871;https://vk.com/wall-15755094_49949045;новости
-15755094_49948905;"Партия экс-президента Болгарии Радева набрала 44,5% голосов на парламентских выборах. 
 
Об этом сообщается на сайте ЦИК после подсчета 100% протоколов. 
 
Радев не раз выступал против военной помощи Украине, призывал Европу пересмотреть отношение к спецоперации и вернуться к дипломатии.
https://vk.cc/cWUgBt";2026-04-20 15:31:09;131;9;27;40965;https://vk.com/wall-15755094_49948905;новости
-15755094_49948816;"В твороге «Савушкин продукт» и «Смолевичи Молоко» нашли остатки опасного вещества. 
 
Речь идет о продукте распада антигельминтного препарата альбендазола — он токсичен для человека, рассказали в Россельхознадзоре. 
 
Белорусскую ветеринарную службу предупредили, что нужно принять меры, также усилили лабораторный контроль.
https://vk.cc/cWUbyZ";2026-04-20 15:07:30;149;334;35;68156;https://vk.com/wall-15755094_49948816;новости
-15755094_49948587;"Разлив нефти обнаружили в море у порта Туапсе. 
 
Это последствия атаки БПЛА в ночь на 16 апреля — тогда была повреждена инфраструктура морского терминала, сообщили в оперштабе Краснодарского края. 
 
Площадь нефтяного пятна оценили в 10 тысяч квадратных метров, для локализации выставили боновые заграждения.
https://vk.cc/cWTZqd";2026-04-20 14:07:40;224;333;93;120596;https://vk.com/wall-15755094_49948587;новости
-15755094_49948455;"В Японии объявили эвакуацию после землетрясения магнитудой 7,5.

Она затронет более 156 тысяч человек в префектурах Хоккайдо, Аомори, Иавтэ, Мияги и Фукусима, передает агентство Киодо. 

Также в стране действует угроза цунами: пока что его максимальная высота составила 80 сантиметров.";2026-04-20 13:31:29;98;34;44;28981;https://vk.com/wall-15755094_49948455;новости
-179925889_2847585;"Международный аэропорт Кансай в Япония построен на искусственных островах в Осакском заливе и действительно постепенно оседает.

Причина — особенности грунта: насыпной слой давит на мягкие глины, вытесняя из них воду, из-за чего поверхность медленно «проседает». С начала строительства первый остров опустился более чем на 13 метров, но сейчас темпы снизились примерно до нескольких сантиметров в год.

При этом объект изначально проектировали с учётом этого процесса: используются регулируемые конст";2026-04-20 17:07:00;2;1;2;362;https://vk.com/wall-179925889_2847585;новости
-179925889_2847544;"В Москва установилась тёплая погода, благоприятная для пикников и отдыха на природе.

Жителям напоминают готовить еду только в специально оборудованных зонах, чтобы избежать пожаров и штрафов.";2026-04-20 16:06:00;1;1;1;679;https://vk.com/wall-179925889_2847544;новости
-179925889_2847483;"Оперная певица Аида Гарифуллина поделилась новым фото с ярким сценическим образом — макияжем с эффектными «блестящими слезами».

Артистка отметила, что, несмотря на насыщенную сценическую жизнь, настоящее счастье для неё — в семье: после концертов она спешит обнять дочь и поцеловать мужа.

Её супруг, Алексей Воробьёв, восхищённо отреагировал на снимок, назвав её «бриллиантом своей души».";2026-04-20 15:06:00;22;1;0;16411;https://vk.com/wall-179925889_2847483;новости
-179925889_2847438;"В Москве 39-летняя женщина скончалась во время косметической процедуры в центре LikeMe. По предварительным данным, ей стало плохо в момент введения обезболивающего препарата.

Прибывшие медики не смогли её спасти — вероятной причиной называют анафилактический шок. Сообщается, что у врача не было лицензии на проведение данной процедуры.";2026-04-20 14:06:00;20;4;2;17441;https://vk.com/wall-179925889_2847438;новости
-179925889_2847408;"В США на круизном лайнере обнаружили тело 18-летней девушки с признаками насильственной смерти.

По данным следствия, в преступлении подозревают её 16-летнего сводного брата. Ранее, как сообщается, он проявлял к ней навязчивое поведение. Сам подросток утверждает, что не помнит произошедшего, однако правоохранители рассматривают мотив, связанный с личной заинтересованностью.

Принято решение судить его как взрослого — в случае признания вины ему может грозить пожизненное заключение.";2026-04-20 13:06:00;99;2;11;53990;https://vk.com/wall-179925889_2847408;новости
-179925889_2847369;"В Таиланд погиб 22-летний чемпион России по пауэрлифтингу. По предварительным данным, ему позвонили мошенники и сообщили ложную новость о смерти отца.

После этого молодой человек в состоянии стресса поехал ночью на байке и попал в серьёзное ДТП. С тяжёлыми травмами головы и переломами его подключили к ИВЛ, однако спасти его не удалось.";2026-04-20 12:05:00;40;2;5;18971;https://vk.com/wall-179925889_2847369;новости
-179925889_2847276;"В Оренбургская область при задержании 52-летний мужчина открыл огонь по полицейским. Один сотрудник погиб на месте, трое получили тяжёлые ранения и находятся в реанимации. 
 
После нападения стрелок скрылся на грузовике ГАЗон. В регионе проводится масштабная операция по его поиску.";2026-04-20 11:05:00;37;2;8;31651;https://vk.com/wall-179925889_2847276;новости
-179925889_2847250;Актрисе Елена Воробей стало плохо на съёмках в Москве. Во время работы у неё резко поднялось давление на фоне переживаний. На место вызвали скорую помощь, медики оказали необходимую помощь.;2026-04-20 10:29:00;49;1;8;16779;https://vk.com/wall-179925889_2847250;новости
-179925889_2847193;С 1 мая списание налоговых долгов будет происходить по-новому - что нужно знать https://myliski.ru/novosti-rossii/12302;2026-04-20 09:00:01;1;2;0;1973;https://vk.com/wall-179925889_2847193;новости
-149802835_699464;"В Астрахани студент из Марокко избил свою возлюбленную, заподозрив в измене

Молодой человек набросился на девушку, применив к ней удушающий прием. Ситуация быстро стала критической: агрессор не ослаблял хватку, и его девушка потеряла сознание от удушья.

Очевидцы вызвали на место инцидента полицию. На иностранца возбудили уголовное дело по статье ""мелкое хулиганство"".

… Своих таких «женихов» хватает, еще и эти сюда приезжают… Это сколько же жестокости надо иметь, чтобы такое с людьми делать…

";2026-04-07 11:59:31;160;9;38;37056;https://vk.com/wall-149802835_699464;новости
-149802835_699350;"⚡️В Азовском море произошло крушение сухогруза типа «Волго-Балт», следовавшего с грузом пшеницы. 

Больше новостей России и Мира https://vk.cc/cWf56Q

По данным главы Херсонской области, экипаж смог покинуть судно и добраться до берега, где были найдены 9 членов команды, все граждане России. К сожалению, один из моряков, старший помощник капитана, 1991 года рождения, погиб, а местонахождение ещё двух членов экипажа остаётся неизвестным.

Морякам оказывается необходимая медицинская и психологичес";2026-04-05 20:38:03;176;14;10;81529;https://vk.com/wall-149802835_699350;новости
-149802835_699314;"⚡️ В Сербии обнаружили взрывчатку рядом с газопроводом, соединяющим страну с Венгрией. 

Больше интересного у нас на канале
https://max.ru/russian_fursach

Президент Александр Вучич сообщил, что силовики нашли два больших пакета с детонаторами, которые могли причинить значительный ущерб и угрожали безопасности людей.

Вучич отметил, что у властей имеются дополнительные улики, однако детали расследования пока остаются под завесой. Он также обсудил ситуацию с премьер-министром Венгрии Виктором Орб";2026-04-05 13:57:12;132;5;3;46753;https://vk.com/wall-149802835_699314;новости
-149802835_699222;Я, Скударнов Руслан Сергеевич, небольшой предприниматель, работал около трех лет подрядчиком в муниципальном унитарном предприятии КОММУНАЛЬНЫЕ ОБЪЕДИНЕНЫЕ СИСТЕМЫ,  на протяжении двух лет  с меня вымогали взятки  за беспрепятственное закрытие контрактов, а также за помощь в изготовлении первичной и исполнительной документации, на третий год работы в данном предприятии, меня уговорили  взять два контракта,  я взял эти два контракта, с большим  трудом  их выполнил и ушёл в минус на сумму более 7.;2026-04-04 16:21:12;630;39;98;123776;https://vk.com/wall-149802835_699222;новости
-149802835_698760;"Филипп Киркоров спокойно курит в аэропорту Барнаула — и, похоже, для него правила работают иначе.
Обычным людям — нельзя, а тут «своя дверь», свои условия, свой уровень допуска.

Наш канал https://max.ru/russian_fursach

Ситуация выглядит показательно: человек ведёт себя так, будто система для него не существует. Даже полиция, по ощущениям, предпочитает не вмешиваться.

Можно сколько угодно обсуждать его связи, в том числе с Дмитрий Песков, говорить о поддержке, покровительстве и влиянии. Но ест";2026-04-01 23:07:58;779;25;345;211835;https://vk.com/wall-149802835_698760;новости
-149802835_698751;"Минстрой вводит программу ликвидации парковок во дворах до 2026 года.

Наш канал https://max.ru/russian_fursach

Всё, что мы имели до настоящего момента в части парковки меркнет перед тем, что Правительство планирует в ближайшие два года. Это приведёт к волнениям.

Речь о внесённой в Правительство Минтрансом т.н. ""Дорожной карты"" от 11 октября 2024 года призванной существенно снизить автомобилизацию страны. Вдумайтесь - в самой большой по территории стране хотят принудительно снизить количество ";2026-04-01 21:20:08;194;49;37;53449;https://vk.com/wall-149802835_698751;новости
-149802835_698528;"Трамп заявил, что любит россиян

Самые срочные новости в max
https://max.ru/russian_fursach

Президент США Дональд Трамп на встрече с Владимиром Зеленским признался, что испытывает любовь к россиянам и хочет завершения конфликта на Украине.
""Я люблю россиян. Я люблю их всех и хочу, чтобы война прекратилась. Это очень важно "", - сказал он.";2026-03-31 12:19:05;903;50;268;148608;https://vk.com/wall-149802835_698528;новости
-149802835_698506;"НЬЮ-ЙОРК. 1935 ГОД. КОГДА ИДЕИ СССР ДОШЛИ ДО АМЕРИКИ

Не забываем про наш канал в мах
https://max.ru/russian_fursach
В нём мы публикуем самые острые новости!

Толпы людей с красными флагами идут по улицам.
Маршируют колонны. Звучат лозунги, знакомые каждому…

Но это не Москва.
Это — Нью-Йорк. Сердце США.

 1 мая 1935 года тысячи людей вышли на демонстрацию под идеями, которые ассоциировались с Советским Союзом.

В момент, когда Америка переживала тяжёлые последствия Великой депрессии,
всё больше";2026-03-28 16:04:55;41;5;2;21643;https://vk.com/wall-149802835_698506;новости
-149802835_695789;"Тысячи мусульман вышли на улицы Питера и Москвы.

Движение на некоторых улицах Питера и Москвы также временно ограничено.

Больше новостей в мах https://max.ru/russian_fursach

Курбан-байрам (Ид аль-Адха) — это исламский праздник жертвоприношения, один из двух главных дней в исламе (наряду с Ураза-байрамом). Он знаменует окончание хаджа (паломничества в Мекку) и отмечается через 70 дней после Ураза-байрама. Праздник символизирует милосердие, преданность Богу, сострадание и длится несколько дней.";2026-03-20 13:14:35;1968;259;2295;409699;https://vk.com/wall-149802835_695789;новости
-149802835_695786;"Мерцает уничтожили в Бундестаге.
Такого ора он не ожидал.
Смотрите до конца.";2026-03-20 12:00:33;95;12;3;16457;https://vk.com/wall-149802835_695786;новости
-58053864_2092698;"«Иди, мась, жри их всех»

На северо-востоке Москвы собачница натравила пса на посетителей и собак на площадке.

Вчера вечером жительницы с собаками пришли на площадку для животных, после туда же пришла женщина с овчаркой. Владелица пса сняла с собаки поводок и намордник и стала травить животное на других собак и людей. Собака укусила одну из жительниц и напала на собак. По словам очевидцев, собачница была нетрезва:

«Особых причин для такого поведения не было, она просто бесцеремонно зашла на пл";2025-10-29 08:50:00;388;47;66;213074;https://vk.com/wall-58053864_2092698;новости
-58053864_2174459;"19-летняя актриса Александрина Олексюк уверена, что ей удалось построить крепкий и стабильный брак с 50-летним режиссёром. 🙏🏻 😇😇😇

➖В прошлом году, на летних каникулax, знаменитый режиссёр Марк Горобцом сделал Александрине предложение руки и сердца. Изначально они планировали объявить об этом событии в день её 18-летия, ожидая особенного момента. Но юная актриса не смогла удержаться и в предвкушении большого события опубликовала фотографии с предложением на своих страницах за четыре дня до насту";2026-04-20 17:30:00;2;1;0;459;https://vk.com/wall-58053864_2174459;новости
-58053864_2174315;"Артисту вынесли суровое наказание.

Радий Лебедев был приговорён к 12 годам лишения свободы в исправительном учреждении за хищение чужих денежных средств путём обмана. Ранее его имя упоминалось в связи с возможным контактом с Ольгой Бузовой.

В ходе расследования выяснилось, что осуждённый присвоил более 66 миллионов рублей, обещая людям прибыль от покупки автомобилей или инвестиций в коммерческие проекты. Суд также назначил ему крупный денежный штраф и обязал вернуть 19 миллионов рублей пострад";2026-04-20 14:30:00;65;4;9;76020;https://vk.com/wall-58053864_2174315;новости
-58053864_2174210;"35-летняя дочь Михаила Задорнова светится от счастья с мужем-ливанцем

Дочь артиста поделилась новым снимком. На фото 35-летняя наследница сатирика запечатлена с мужем-ливанцем Али Тартуси. Судя по фото, супруги счастливы вместе.

Они познакомились в Париже, а в 2021 году узаконили отношения. Елена родила от мужа троих детей. Впервые она сообщила о двоих наследниках в июне 2023 года. В декабре того же года назвала себя «трижды матерью».";2026-04-20 12:30:00;79;10;12;44109;https://vk.com/wall-58053864_2174210;новости
