id,text,date,likes,reposts,comments,views,url,topic
-196446214_650473,"Такую ель не захотите убирать даже после нового года!

Сейчас на премиальные литые ели действует скидка −36% — это самые низкие цены за весь год

На фото — реальные ели:
• 100% литая хвоя
• максимально реалистичный вид
• выглядят как живая ель, только без осыпания и прослужит от 10 лет

Летом ниже цен не будет

Каталог с более 40 разными елками по ссылке: https://vk.cc/cWkn1l",2026-04-10 11:00:00,15,0,0,2741,https://vk.com/wall-196446214_650473,животные
-196446214_650451,"‼️Родители, важное сообщение.
📌С 1 апреля 2026г. для каждого школьника РФ организована бесплатная шестимесячная программа обучения «Нейросети и искусственный интеллект с нуля». Это отличная возможность записать своего ребёнка и получить 6 месяцев бесплатного обучения!

Задача обучающей программы - показать школьникам азы программирования и определить насколько им нравятся IT специальности. Ребенок сможет подготовить почву для своей будущей карьеры, изучив основные концепции компьютерного програм",2026-04-10 08:15:26,12,1,0,7951,https://vk.com/wall-196446214_650451,животные
-196446214_650430,"https://vk.cc/cV6GbN

Выращиваете рассаду сами? Тогда знаете, как обидно терять ее перед высадкой 

Биомолекулы «Удобряй!» помогают укрепить каждый росток:
• меньше болезней
• качественнее корни
• лучше приживаемость

Компактный флакон удобно взять на дачу

Экономичный расход и полностью органический состав

Забота о будущем урожае начинается уже сейчас

Заказать https://vk.cc/cV6GbN",2026-04-10 06:40:00,6,0,0,3608,https://vk.com/wall-196446214_650430,животные
-196446214_650428,"Максим уныло сидел пред монитором. Осталось два дня, и ему надо было сдавать статью в журнал, а у него ничего не получалось. Материал он собрал своевременно, редактору наброски предоставил. Тот их одобрил, но сказал: 
 
- Максим, у нас научно популярный журнал. Для детей и молодежи. Ты – молодежь? 
 
Максиму было двадцать шесть, и он мог еще с уверенностью себя отнести к данной категории. 
 
- Вот и подумай – как надо изложить материал, чтобы заинтересовать, если не твоих сверстников (им, я дума",2026-04-10 06:00:00,298,7,8,9474,https://vk.com/wall-196446214_650428,животные
-196446214_650320,"- Боже мой, Леша! Что ты снова в дом притащил? – глаза бабушки округлились настолько, что даже очки удивленно поползли вверх по переносице. Если честно, она уже привыкла к разным озорствам внука, но надо же для порядка изобразить недовольство. 
- Ба, он будет жить с нами. Я никогда его не брошу. – Безапелляционно заявил семилетний мальчишка, прижимая к себе рыжий пушистый комочек, который уже не боялся и не пищал, полностью доверяя странному, большому и теплому существу. Лешка чувствовал огромну",2026-04-09 18:00:19,634,28,11,17918,https://vk.com/wall-196446214_650320,животные
-196446214_650240,"Моя подруга решила заработать на кошечках. Ну как заработать. Пассивно. Поэтому она завела не кошку, а кота. Породы мейн-кун. Решила, что на спаривании этого красавца срубит бабла. Правда, кот был без документов, зато продавали его удивительно дешево - всего за 10 тысяч рублей, что в наших краях просто невероятно мало. Правда, пришлось за ним ехать аж в Самару, но чего не сделаешь ради будущих миллионов? 
 
За вязку подруга планировала брать 20 000 рублей. Если вязать его хотя бы раз в месяц, ме",2026-04-09 13:40:59,685,89,26,27506,https://vk.com/wall-196446214_650240,животные
-199794190_10877,Тоже решила присоединиться к йоге...,2024-05-16 12:00:02,2008,257,40,77210,https://vk.com/wall-199794190_10877,животные
-199794190_138712,"Мы купили дом. С выставки. Стоял он там долго, с полгода, не меньше, зато дешевле на двадцать процентов от полной цены. 
Поставили нам его на участке быстро, правда не без происшествий. Один из строителей сорвался с крыши, когда её монтировали, ногу сломал. Говорил, что-то его столкнуло, но бригадир ворчал, что с похмелья не нужно выходить на работу, а уж тем более, лезть наверх. 
Ничего плохого про саму фирму сказать не могу, строение вроде бы добротное, качественное, тёплое. 
Так что, на этом ",2026-04-10 18:00:00,0,0,0,27,https://vk.com/wall-199794190_138712,животные
-199794190_138637,"Кошка, схватив в зубы сонного котёнка, унесла его в коридор к входной двери. Она бросилась назад в спальню, громко мяукая. Профессор крепко спал. Огонь подобрался к ковру на полу спальни. Комната мгновенно заполнилась едким дымом. Мадам запрыгнула на кровать и с пронзительным криком начала яростно рвать когтями одеяло, укрывавшее хозяина. 
 
Старый профессор, как обычно, все вечера проводил в своём кабинете. Он перелистывал страницы толстых книг, делая какие-то пометки и записывая в свою тетрадь",2026-04-10 12:00:01,194,4,16,3726,https://vk.com/wall-199794190_138637,животные
-199794190_138565,"Галя всегда мечтала о большой семье. Такой, чтобы любящий муж и трое, нет, четверо детей! 
Ещё в детском садике Галочка помогала нянечкам ухаживать за младшими, а вечером пеленала своих бесчисленных кукол и пела им на ночь колыбельные, которые сама же, на ходу, и придумывала. 
Галя (""Галчуша"", как называли её родители) росла единственным ребёнком в семье, и уж чем-чем, а вниманием со стороны многочисленной родни обделена не была — дорогие игрушки, лучшие развивающие пособия...и горькое одиночест",2026-04-10 06:00:01,89,1,1,2041,https://vk.com/wall-199794190_138565,животные
-199794190_138465,"Рыжий лохматый комок сидел на стуле, демонстративно отвернувшись от Сашки, когда я вошла на кухню. Видно было, что кот не знает чего хочет больше, то ли спать, то ли обижаться. 
 
- Ну, и кто опять Баську обидел? – специально грозным голосом уточнила я. 
 
-Да не знаю я, чего он…сидит…что-то надулся, Бааааась? – муж попробовал погладить котейку, тот только отодвинулся подальше и посмотрел на меня жалобным взглядом. 
 
А во взгляде была вся трагедия кошачьего народа. 
 
-Баська, кто тебя обижал? ",2026-04-09 18:00:04,124,5,6,2503,https://vk.com/wall-199794190_138465,животные
-199794190_138425,"В детстве я каждое лето проводил у тетки в деревне, да и сейчас стараюсь вырваться туда в отпуск. Чистый воздух, речка, грибной лес и очень плохая сотовая связь. Мозги прочищаются, улетучиваются дурные мысли, никто с работы не мешает отдыху души. 
 
В тот год случилось нашествие крыс. То ли они проложили удобную транзитную дорожку в хлебные места, то ли что-то понравилось в самой хате. Пойдешь ночью на кухню и обязательно заметишь длинный хвост, который протискивается в какую-то щель. Или решишь",2026-04-09 13:37:50,85,2,3,1708,https://vk.com/wall-199794190_138425,животные
-199794190_138354,"Маргарите Тихоновне дети привезли кота на недельку. Они решили съездить отдохнуть в санаторий, а туда с животными не пускали. 
 
Васька был огромным, упитанным и очень серьезным котом. Дочка сразу предупредила, что их питомец, мягко говоря, очень хорошо кушает. 
 
Но мать не обратила на это внимание, уж прокормит как-нибудь его. И добавила потом, чтоб езжали и не волновались за своего хвостатого. 
 
А вот когда за детьми закрылась дверь, женщина погладила Василия и сказала, что сейчас положит ем",2026-04-09 06:00:00,479,12,19,12484,https://vk.com/wall-199794190_138354,животные
-199794190_138282,"Я привез в Туру (кто не знает — этот поселок является административным центром Эвенкии) из омской деревни белоснежного крольчонка с темненькими ушками, которого мне подарил брат. Жена и сын тут же влюбились в это очаровательное создание. Назвали его Стёпкой. 
 
Он ел все: хлеб, яблоки, капусту, хрупал сеном. Мало того, оказалось, что это кроткое существо с удовольствием уплетает сыр и колбаску! 
Клетку для кролика построили большую, с решетчатым полом, обтянутую металлической сеткой. Степка дисц",2026-04-08 18:00:01,221,6,10,5534,https://vk.com/wall-199794190_138282,животные
-199794190_138212,"Было морозно. Кристина из школы торопилась домой. Во дворе девочка снова увидела беременную кошечку. Несчастная, она появилась там вчера и сиротливо сидела на одном месте, не двигаясь и смотря в одну точку. 
 
Родители забрать ее, конечно не разрешили, но кошку было так жалко... И Кристина позвонила своей подруге Лере. Лерины родители тоже отказали, но зато у той возник план, который Кристинке очень понравился. Выпросив у родителей по 200 рублей, они побежали в Фикс Прайс. 
 
Купили там два флис",2026-04-08 12:00:02,319,2,17,6835,https://vk.com/wall-199794190_138212,животные
