id,text,date,likes,reposts,comments,views,url,topic
-196446229_531449,Они жили они как кошка с собакой...,2025-05-23 22:03:04,1487,126,31,52917,https://vk.com/wall-196446229_531449,животные
-196446229_565159,"Был тихий сентябрьский вечер, воскресенье. Окна, еще раскрытые настежь, впускали приятную прохладу ранней осени. Я писал письмо своей очередной виртуальной подружке и с головой погрузился в красивое словоблудие. От испуга даже уронил клавиатуру с колен. Чертыхнувшись, пошел открывать. В дверь уже настойчиво тарабанили. 
- Кому же так неймется? Кулаки отобьете! 
За дверью стоял соседский пацан Васек. 
- Спрячьте его, а то мать выкинет. Я потом заберу, когда можно будет, - прошептал он, сунув мне ",2026-04-10 18:00:00,3,0,0,60,https://vk.com/wall-196446229_565159,животные
-196446229_565007,"- А я говорю, иди, - настаивала большая ворона. - Иди, тебе говорю. Я в людях разбираюсь. Эта точно тебя возьмёт. 
 
Но серый грязный кот всё никак не мог решиться. 
 
- Старый я, некрасивый и вообще. Если она захочет, к ней любой котёнок побежит. Видишь, какая хорошая. Каждый раз выносит во двор вкусные кусочки курочки и бездомным котам и собачкам оставляет. Зачем ей такой старик? 
 
Ворона распушила перья и взмахнула крыльями. 
 
- Это совершенно невозможно! С тобой разговаривать просто одно р",2026-04-10 12:00:00,173,6,13,3510,https://vk.com/wall-196446229_565007,животные
-196446229_564945,"Посмотрите какой шикарный кислородный пятновыводитель очиститель на WB! 🔥 https://www.wildberries.ru/catalog/521537522/detail.aspx?utm_source=adb&utm_medium=cpc&utm_campaign=28869-id-laun_kislorod

- Активный кислород в составе - эффективно удаляет любые пятна и загрязнения

- НЕ содержит агрессивный хлор, безопасен для детских вещей (0+) 👶

- Более 100 доказанных способов применения: идеально подойдёт для чистки одежды, обуви, посуды, обивки мягкой мебели, ювелирных изделий из золота и серебра,",2026-04-10 10:06:47,2,0,0,1627,https://vk.com/wall-196446229_564945,животные
-196446229_564849,"Были у нас в гостях как-то близкий друг семьи и его приятель. Всё чинно-благородно, сидят себе нормально, я у плиты. Потом получилось так, что этот приятель активно жестикулируя, что-то рассказывает и задевает сковороду, стоящую на полном огне. 
Далее всё происходило моментально, но попробуйте представить как в замедленной съёмке. 
Сковорода начинает падать на вертящегося у плиты кота, я одной рукой хватаю котика, второй пытаюсь поймать сковородку (что с моей стороны крайне глупо, она же раскалё",2026-04-10 06:00:00,145,1,3,4023,https://vk.com/wall-196446229_564849,животные
-196446229_564690,"Был канун Нового года. 31 декабря. Выходной. Середина дня. За окном была самая настоящая слякоть, и в воздухе ударяясь в стекло мела изморось. Знаете, что такое мелкий противный холодный дождь со снегом? Так вот именно это и было. Я рассталась со со своим мужчиной и встречать праздник было решительно не с кем. 
К родственникам ехать не хотелось. Не хотелось слышать их вопросы о моей жизни, свои ответы, а потом смотреть на их сочувствующие лица. 
На улице и на сердце были заморозки. Так-то, вот. ",2026-04-09 19:35:04,92,1,2,2453,https://vk.com/wall-196446229_564690,животные
-196446229_564671,"Ликвидация мебели в интернет-магазине НОНТОН!

Cуперскидки до 80% на остатки мебели!
Диваны, кресла, столы, комоды и другие товары по рекордно низким ценам — в считанных экземплярах.

Если нашли мебель, которая вам подходит — забирайте сейчас, завтра её может уже не быть — смотрите каталог здесь https://vk.cc/cU1daR!

После продажи последней единицы предложение исчезнет.",2026-04-09 18:35:00,4,3,0,2837,https://vk.com/wall-196446229_564671,животные
-196446229_564562,"Я вообще никогда не любил сфинксов. 
Нет, не египетских сфинксов, а голых, похожих на ночной кошмар, кошек. И жена их тоже не любила. Потому, что они один раз её напугали до дрожи в ногах. Что может быть омерзительнее голой кошки? Только голый кот! 
Как-то раз, приезжаю я на заказ без обратного адреса. Выходит пара: парень и девушка, а на руках у девушки эта гадость лысая. Садятся они, а я спрашиваю: 
— Куда едем, ребята? 
А они отвечают: 
— Да куда-нибудь, подальше. 
Я не понял. Попросил уточни",2026-04-09 13:44:13,386,13,19,7253,https://vk.com/wall-196446229_564562,животные
-196446229_564436,"Лора забралась в высокую траву, легла и забубнила... Ну вот что за жизнь? Из уютного подвала прогнала дворничиха, хлопнув для убедительности по пушистой ""корме"" веником. Но Лора не была бы кошкой, если бы не отомстила. 
 
Поэтому, уворачиваясь между ног от грозного ""оружия"", крепко цапнула женщину за полную и варикозную лодыжку. Долго она еще будет помнить бедную Лорочку! Эх, жаль, что кошки не ядовиты... 
 
Лора побубнила, почесалась, умылась. Все дела на сегодня сделаны, нужно подумать и о ноч",2026-04-09 06:00:00,202,5,5,4801,https://vk.com/wall-196446229_564436,животные
-196446229_564271,"Котенок прятался в подъезде под батареей. Правда, едва теплый кусок железа не очень то и оберегал от холода. Кто-то очень ""заботливый"" постелил ему кусок от картонной коробки и поставил рядом пластиковую упаковку из-под сельди. Ее не удосужились даже помыть и вода была налита прямо в воняющий рыбой пластик. 
 
Влада всегда мечтала о кошке. Но родители были против. Правда обещали, что вот если закончит учебный год на одни пятерки... Понятно, что для Влады это было на грани фантастики и кошки у не",2026-04-08 18:00:00,702,18,14,12587,https://vk.com/wall-196446229_564271,животные
-199741490_91025,"Сколько раз смотрю, столько раз радуюсь!",2024-03-03 06:00:00,2473,906,94,105193,https://vk.com/wall-199741490_91025,животные
-199741490_230504,"Кошку звали Мусечка, Муська, Муся. Всё в зависимости от того, как она себя вела. А вела она себя по-разному. Очень характерная кошка, эта самая Муська. Чуть что не так – лапой по руке или ноге. Спасибо, что без когтей. Но если говорить правду, то была она пугливой и ласковой. Больше всего любила, когда мужчина гладил её черно-белый животик. 
Ещё Мусечка любила гулять на улице. Нет. Не машите руками. И не говорите, что кошка, которую выпускают – обречена. Мусечка была очень умной кошкой, и сама н",2026-04-10 18:00:00,0,0,0,43,https://vk.com/wall-199741490_230504,животные
-199741490_230360,"Мужчина шел по тротуару. Он очень спешил на работу. Он был начальником большого отдела одной архитектурной фирмы. Работы было много. Поэтому он на ходу перекусывал большим гамбургером. 
 
За ним бежал маленький котёнок. Серенький. Мужчина морщился. Ему некогда было отвлекаться на такие мелочи, и он… 
 
Просто отпихнул маленького, голодного котёнка. Тот, испугавшись, пискнул и отпрыгнул в сторону. Прямо на проезжую часть. Большой красный кроссовер даже не попытался затормозить. Просто пронёсся ми",2026-04-10 12:00:00,121,11,4,2416,https://vk.com/wall-199741490_230360,животные
-199741490_230182,"Клео прошлась по спинке дивана. Отсюда было ближе всего к тому непонятному и вредному предмету, который так расстраивал ее хозяйку! Она поднялась на задние лапы, вытянулась и сердито ударила по стеклу, за которым он лежал. 
Нет, никак не достать. А то бы она ему показала! 
Вредным предметом был тонометр. Он появился в жизни кошки недавно. 
Раньше его точно не было! И жили они прекрасно! Если бы кошка умела считать, то она бы сказала – две недели назад. Две недели назад хозяйка принесла домой эту",2026-04-10 06:00:00,132,2,5,3555,https://vk.com/wall-199741490_230182,животные
-199741490_230007,"В жизни Алёнки всё было наперекосяк. Билеты на экзаменах непременно с теми вопросами, которые она недоучила. На работе либо начальник гад, либо не коллектив, а безобразие полнейшее, либо сама накосячит так, что потом совестно коллегам в глаза смотреть. По дороге на собеседование, в гости или на корпоратив обязательно каблук сломается или проезжающая мимо машина окатит грязью из лужи. О любви она вообще говорить ни с кем не хотела, потому что в этом отношении ей не везло хронически. 
― Ну почему ",2026-04-09 18:00:22,105,5,1,4338,https://vk.com/wall-199741490_230007,животные
-199741490_229912,"...Меня взяли! Слышите, люди? Меня взяли! Меня, «жалкого запёрдыша», «калеку никчёмного», «на фиг его оставлять-то».... Меня ВЗЯЛИ! Я дождался. 
О, боги кошачьи, как я ждал! Каждый раз, когда приходили «на смотрины», моё сердце бешено колотилось, я так ждал, что и меня вынут из клетки и покажут, и я намывался, я лизал до блеска свою шёрстку, расправлял волосок к волоску, чтоб то, что осталось на мне после постоянных уколов, лежало красиво. Я намывал свою мордочку, вылизывал лапки, расправлял хво",2026-04-09 13:46:16,441,25,38,7389,https://vk.com/wall-199741490_229912,животные
-199741490_229738,"У моей очень энергичной и эксцентричной бабули есть кот, подобранный где-то на помойке, и соответственно воспитанный в идеалах свободы личности и правом полного самовыражения. 
 
Уезжая как-то на горнолыжный курорт (в 79 лет!), она не долго думая, своего питомца, с редким именем Вася, не спросив ни моего ни Васиного согласия, привезла ко мне пожить. 
 
Вася был страшен - огромный, наглый, драный тип. Вся морда в шрамах, ухо порвано - цвет пегий. Нет, может он когда-то был рыжим, но вымыть эти де",2026-04-09 06:00:00,1086,52,18,18680,https://vk.com/wall-199741490_229738,животные
-199741490_229495,"На детской площадке ребёнок забыл игрушку... Мамочки подняли её, отряхнули и положили на тонкий, ограждающий площадку забор. Яркая собачка при первом же порыве ветра покачнулась и упала по ту сторону, исчезнув на заросшем участке. 
 
А там – на малюсеньком, утоптанном мягкими лапками пятачке, дремала маленькая Лычка, кошечка, которая осталась совсем одна. Её распахнувшиеся почти на всю мордашку глаза взирали на игрушку с ужасом и интересом. Собачка не двигалась... 
 
От игрушки пахло молоком и п",2026-04-08 18:00:01,1455,65,52,23162,https://vk.com/wall-199741490_229495,животные
-199741490_229357,"На улице темно. Очень голодно. И конечно же страшно. Но поздним вечером безопасней - нет громко шумящих машин и собаки, патрулирующие улицу алчными стами, уже где-то спят. 
Можно выходить... Котенок робко вылез из-под крыльца и пригибаясь к земле, он неловко сделал несколько шагов. Порыв ветра зашуршал листьями и их шорох напугал котенка. Фунтик пригнулся и прыгнул под скамейку. 
На скамье сидела девушка и увлеченно беседовала по телефону, иногда срываясь на крик. Только Фунтик был зачарован дру",2026-04-08 12:00:40,555,15,14,11613,https://vk.com/wall-199741490_229357,животные
-44042424_93742,"АКТУАЛЬНА ЛЮБАЯ ПОМОЩЬ, ФИНАНСОВАЯ(В ВЫВОЗЕ СОБАЧЕК, ЛЕЧЕНИИ), ИНФОРМАЦИОННАЯ❗

Уважаемые гости данной странички! 
В каталоге выставлены фото собак невозвратных с отлова Уфы. Мы ищем им семьи или кураторов срочно! Телефоны для связи: 89659366663 
89876276630

https://t.me/katalog_sobak_ufa

Срочно ищем дом или кураторов 🆘🆘🆘
+79659366663 Вероника
+79856331399 Наталья
+79279633599 Арина",2026-03-07 22:03:36,116,41,302,3836,https://vk.com/wall-44042424_93742,животные
-44042424_110051,"МО, ОРЕХОВО-ЗУЕВО.
КОТ НА КРЫШЕ!!! 🆘🆘🆘
НУЖНА ПОМОЩЬ:ДОМ ИЛИ ВРЕМЕННАЯ ПЕРЕДЕРЖКА ДО ПРИСТРОЙСТВА🆘
Бедняга не спускается,боится..Сидит и плачет, когда хочет кушать.... Многие жители против такого соседа, угрожают.... Да и что это за жизнь? В крыше есть какая-то дырка,там проходит вентиляция и это очень опасно для котика. Если он туда упадёт, то погибнет!🆘
Неравнодушная женщина подкармливает его и очень просит помощи🙏🏻Долго он там не протянет.... Помогите, пожалуйста, найти любящее сердце и тёплый",2026-04-10 17:09:35,0,0,0,5,https://vk.com/wall-44042424_110051,животные
-44042424_110049,"‼️‼️‼️МЕГА СОС‼️‼️‼️

Оренбургская область ,
Смертельный отлов🏴‍☠️

🚨Эти ребята без брони❗

Срочно нужен дом, передержка, финкураторы❗️Только вместе можем спасти эти жизни 🛑

Пожалуйста, напишите нам:
Диана  +79228448915  
ВК https://vk.ru/dkosyan
ТГ @Dianna_Kosyan
Алёна  +79619083111
ВК https://vk.ru/t_a_samaya
ТГ @lesposadka

Отправка в другие города! 

🐾 ВСТУПАЙТЕ В ГРУППУ СПАСЕНИЯ:
Макс - https://max.ru/join/gxmOOUyVgSIPShTFdBAYgyf6M-wTg6sSS0wgas-8lWk
 Группа в ВК
vk.com/saveorendogs
ТГ http",2026-04-10 17:09:12,0,0,0,4,https://vk.com/wall-44042424_110049,животные
-44042424_110047,"Сергиев Посад 
💛СОБАКА ИЩЕТ ДОМ!💛 

🧡Овчаристой Мире 6 лет и она найдëныш, которого никто не искал.
 🧡Так Мираша с самого детства оказалась в приюте, где проживает в тесноте, да не в обиде.
🧡У Миры хороший и добрый нрав.
 Она трусиха и милая скромница, но девчонке просто не хватает тепла и внимания человека, кто вселил бы в неё собачью уверенность. 
🧡Мираша здорова, привита, и все 6 лет  ждëт-дожидается своей единственной дороги домой, где может стать второй собакой в семье, ведь Мира абсолютно ",2026-04-10 17:08:54,1,0,1,4,https://vk.com/wall-44042424_110047,животные
-44042424_110046,"Посмотрите, сколько надежды в этих милых щенячьих глазах! Как хочется щенуле быть любимым и нужным, знать заботу и безопасность! Щенята, как и дети, надеются на чудо! Нельзя огорчать такого малыша! Пусть случится в его жизни чудо и он окажется дома! 
Бату всего 2,5 месяца, но уже видно, что он вырастет большой умницей, сообразительным и веселым- отличный вариант для дома или квартиры! 
Липецк, но мы организуем доставку до вашего города! 
Сделаны первые обработки и прививка 
8 915 557 80 65",2026-04-10 17:08:47,0,0,0,1,https://vk.com/wall-44042424_110046,животные
-44042424_110037,"⚠️ Найден(а) 7 щенков

📍 Лыткарино
10.04.26

🆘 ЩЕНКИ НА УЛИЦЕ 🆘

📍 Место: Лыткарино, Московская область
📅 Дата: 10 апреля 2026 года

‼️Несколько дней назад в поселке на пустой участок подбросили 7 щенков без мамочки. Маленькие комочки вынуждены скитаться и пытаться выжить одни в этой суровой реальности😢

💔 Ситуация критическая:

Нужна ваша помощь:🙏🙏🙏

- Найти тёплый дом и любящих хозяев для щенков
- Возможно, кто-то сможет помочь с временным приютом или кормом.

📞 Контакт:
+7 926 661-53-82 Татья",2026-04-10 16:22:27,10,5,0,130,https://vk.com/wall-44042424_110037,животные
-196446214_341222,"Папа волк пришел к любимой семье. 
Волки умеют любить!",2024-04-12 10:00:05,10952,1064,249,435473,https://vk.com/wall-196446214_341222,животные
-196446214_650528,"Собрались соседские девушки по грибы. Моя жена тоже с ними. Договорились они на следующее утро выезжать на машине. 
 
Ну, в 9:00 утра я уже жену собрал, инструктирую: 
- Панаму с широкими полями – это от клещей! Чтоб не сыпались сверху за шиворот. Плотную куртку мою возьми (ещё от старой работы охранником осталась) обязательно! Это от комаров, чтоб не прокусили. И воротник подними! Так, что ещё? А-а-а, конечно, палку грибника! 
 
Достаю обрезок от дюймовой доски, примерно 4 на 2,5 см в сечении и",2026-04-10 14:59:00,85,5,4,4746,https://vk.com/wall-196446214_650528,животные
-196446214_650502,"Семейный портрет — это больше, чем просто изображение.
Это визуальная история о самых близких людях.

Каждый портрет создаётся индивидуально и с вниманием к деталям.
В результате рождается работа, наполненная уютом и смыслом.
Это память, которая будет цениться годами.

Переходи по ссылке, чтобы узнать подробности: https://vk.cc/cWofj7",2026-04-10 13:59:30,9,0,1,3786,https://vk.com/wall-196446214_650502,животные
-196446214_650485,"Три года назад ранней весной появился у меня новый жилец. Мне на День Рождения друзья подарили котеночка. Такая удивительно серебристо-голубая короткошерстная кошечка с серо-голубыми глазами. Грациозная и очень ласковая, наша Маркиза. 
 
Она быстро поняла все премудрости житья в нашей квартире, успешно ходила на лоток и полюбила когтеточку. Спала она со мной, мягко мурлыкая и сладко потягиваясь, когда я вставала утром на работу. 
 
И жили бы мы с нею душа в душу, да пришлось нам расстаться. Толь",2026-04-10 12:00:01,171,5,2,6379,https://vk.com/wall-196446214_650485,животные
