id;text;date;likes;reposts;comments;views;url;topic
-58053864_2174146;"Иван Дмитриенко во время выступления в Екатеринбурге обратил внимание на нескольких девушек, которые танцевали в зале.

Он с улыбкой посмотрел на них и попытался повторить их движения, назвав их «пенсионным фондом». Затем он сказал: «Это потрясающе!»
Некоторые зрители восприняли это как шутку, но другие посчитали это высказывание неуважительным и выразили своё недовольство.

Они заявили, что хотят «отменить» исполнителя за то, что он проявил неуважение к своим поклонникам.";2026-04-20 10:59:00;220;14;53;123127;https://vk.com/wall-58053864_2174146;новости
-58053864_2174069;"Срочно ищу помощниц в ландшафтный дизайн. Обучаю сама с нуля

План простой, как бутерброд:

1. Проходите курс по дизайн ландшафта (есть 20 мест без оплаты) https://sosnovka-projects.ru/new_online?utm_source=vk_mp_plad&utm_medium=varfalomeev&utm_term=avatar1&utm_campaign=4699-z1-3&utm_content=gr4

2. Ровно через 3 дня берете первый заказ и получаете оплату на карту в размере 5-7 тысяч рублей.

3. Зарабатываете в любое удобное время. Знания от вас никуда не денутся, а заказов вагон и маленькая тел";2026-04-20 09:55:00;7;3;1;9303;https://vk.com/wall-58053864_2174069;новости
-58053864_2173988;"Сбежала с Родины поджав хвост

Ведущая многолетней телевизионной программы о здоровье покинула Россию и обосновалась в Соединённых Штатах. Такой шаг объясняется тем, что в США проживают оба её сына. Старший работает врачом и воспитывает двоих детей, младший строит карьеру в области юриспруденции.

Несмотря на сообщения в СМИ о возможном завершении её телевизионной карьеры, представители федерального канала подчеркнули, что сотрудничество с ведущей не прекращается. Она сама подтверждает, что осно";2026-04-20 08:21:44;196;39;102;119580;https://vk.com/wall-58053864_2173988;новости
-58053864_2173907;"В Екатеринбурге мама случайно услышала, что сын говорит о ней другу. 
После этого она не спала до утра.

Сын попросил купить кроссовки — те самые, которые у всех в классе. Цена — шесть тысяч. 

Марина сказала: «Подождём до зарплаты». Сын кивнул. Ушёл в комнату.

Через стену она услышала, как он говорит другу по телефону: «Не, мама не может». Не злобно. Просто как факт.

Она сидела на кухне и не могла встать. Не потому что обиделась, а потому что он был прав.

Марина Соколова работала бухгалтером";2026-04-20 06:13:16;63;1;4;86473;https://vk.com/wall-58053864_2173907;новости
-58053864_2173874;"В Уфе школьник устроил истерику прямо в пункте выдачи заказов

Как оказалось он втихаря заказал дорогую приставку с аккаунта мамы. Родители отказались ее забирать

Мальчик начал кричать, плакать, обвинять родителей в том, что «они всё испортили»

Сотрудникам пришлось вмешаться, люди снимали происходящее на видео

На самом деле этот случай не уникальный.

Родители отказываются купить игрушку - ребенок устраивает истерику.

Любое хоть чуть-чуть усложнённое задание выводит его из себя. Он отказывае";2026-04-20 03:43:41;106;12;2;69762;https://vk.com/wall-58053864_2173874;новости
-58053864_2173727;"Жительница небольшого поселка Романовка пришла в отделение почты с коробкой, настаивая на отправке ее в соседний город. Сотрудники почты потребовали открыть коробку и оказались в шоке, обнаружив внутри спящего младенца, которого женщина пыталась отправить по почте к отцу.

Прибывшим на место происшествия полицейским женщина объяснила, что у нее нет возможности содержать дочь, а новый партнер не хочет брать на себя заботу о чужом ребенке.";2026-04-19 20:30:00;637;262;75;251184;https://vk.com/wall-58053864_2173727;новости
-40316705_54774086;Александр Лукашенко дал RT эксклюзивное интервью, в котором рассказал ведущему Рику Санчесу, почему Запад называет его «последним диктатором Европы» и как борьба с несправедливостью стала основой его политики. Президент подчеркнул, что западные лидеры — временщики, зависящие от богатых спонсоров, в отличие от него, отвечающего перед народом. Глава государства отметил, что Белоруссия адаптировалась к санкциям и готова к «большой сделке» с США, но не ценой национальных интересов. Лукашенко также з;2026-04-20 09:40:00;36;5;6;12314;https://vk.com/wall-40316705_54774086;новости
-40316705_54775476;"Иран сорвал планы США одним ходом.

Тегеран нарушил военные расчёты Вашингтона, предложив открыть Ормузский пролив. Такое мнение выразил американский дипломат в отставке Час Фриман в эфире YouTube-канала.

По его словам, администрация Дональда Трампа планировала разрешить ситуацию в проливе с помощью некоего «военного взрыва».

https://ru.rt.com/yrrx

Подписывайтесь на RT в MAX: https://vk.cc/cPWupT";2026-04-20 17:57:00;1;0;0;107;https://vk.com/wall-40316705_54775476;новости
-40316705_54775457;"«Девять месяцев я штурмовал позиции, пока не получил тяжёлое ранение»: МВД после запроса RT помогает участнику СВО из Казахстана, у которого сгорели документы, стать гражданином РФ: https://russian.rt.com/russia/article/1621213-uchastnik-svo-kazahstan-grazhdanstvo-rf

#НеОдинНаОдин

Подписывайтесь на RT в MAX: https://vk.cc/cPWupT";2026-04-20 17:50:00;12;0;1;1118;https://vk.com/wall-40316705_54775457;новости
-40316705_54775448;"Ряд пользователей по всему миру жалуются на сбои в ChatGPT.

ИИ-бот не отвечает на запросы или вообще не открывается, пишут в сети.

Подписывайтесь на RT в MAX: https://vk.cc/cPWupT";2026-04-20 17:47:04;6;1;0;1362;https://vk.com/wall-40316705_54775448;новости
-40316705_54775438;"RT узнал имена героев, которые спасли попавших под лавину женщину с ребёнком в Дагестане.

1. Шахбан Магомедов (он моложе всех, учится в 11-м классе) (00:00—00:01).

2. Зайнудин Газиев (00:02—00:03).

3. Али Исрапилов (00:03—00:05).

4. Хайрула Магомедшапиев (00:05—00:06). 

5. Шафи Магомедшапиев (00:07—00:09). 

6. Магди Магомедов (00:09—00:10).

7. Жамалудин Магомедов (00:11—00:12).

8. Ибрагим Ибрагимов (00:13—00:14).

9. Абдурахман Алиев (00:14—00:16).

Сразу после схода лавины подмогу привё";2026-04-20 17:44:02;13;0;1;1440;https://vk.com/wall-40316705_54775438;новости
-40316705_54775403;"«Собственные ощущения», на которые полагается в политике Трамп, могут его «не туда завести», считает Лукашенко.

Ранее глава США заявил, что его власть ограничивается только «собственными морально-этическими принципами».

В интервью ведущему RT Рику Санчесу белорусский президент отметил:

«Когда ты возглавляешь такую империю, надо уметь слушать людей, прислушиваться к их мнению и делать соответствующие выводы. Этого у вас нет. Это большая проблема».

https://ru.rt.com/yrjy

Подписывайтесь на RT ";2026-04-20 17:36:00;6;0;0;1993;https://vk.com/wall-40316705_54775403;новости
-40316705_54775378;"Стало известно, кто возглавит МИД Венгрии. 

«Министром иностранных дел… будет Анита Орбан», — заявил лидер победившей на парламентских выборах партии «Тиса» Петер Мадьяр на пресс-конференции по итогам совещания фракции.

Он также добавил, что кандидат уже приняла это предложение.

https://ru.rt.com/yrs4

Подписывайтесь на RT в MAX: https://vk.cc/cPWupT";2026-04-20 17:29:00;8;2;1;2098;https://vk.com/wall-40316705_54775378;новости
-40316705_54775357;"За блогера, пропавшего в Иране во время беспорядков этой зимой, неизвестные просили выкуп в 1 млн рублей криптовалютой. По данным родственников Сергея Черемисинова, его могли задержать за «несанкционированную съёмку» в Ширазе. 

Подробнее о происшествии: https://russian.rt.com/russia/article/1620591-bloger-arest-iran-vykup

Подписывайтесь на RT в MAX: https://vk.cc/cPWupT";2026-04-20 17:22:00;5;0;0;3514;https://vk.com/wall-40316705_54775357;новости
-40316705_54775349;"Ещё для трёх семей из Дагестана, чьи дома пострадали в страшном наводнении, благодаря певице Жасмин сняли жильё.

RT на месте продолжает организовывать адресную помощь. Информацию мы передаём Жасмин, а она помогает с оплатой, в том числе с арендой жилья и ремонтом.

— У Альбины и её супруга пятеро детей. Им было важно жить в квартире недалеко от школы. Теперь съёмное жильё вблизи учебного заведения. Сама квартира светлая, просторная, а на кухне можно принимать гостей.

— Их дом сейчас в очень пл";2026-04-20 17:15:00;18;0;0;2765;https://vk.com/wall-40316705_54775349;новости
-40316705_54775337;"США «аукнется» убийство руководства Ирана, уверен Лукашенко. 

Об этом он заявил в интервью ведущему RT Рику Санчесу:

«Вы показали своё лицо. Убили — ну и что дальше? На место руководителей убитых пришли другие, более радикальные».

https://ru.rt.com/yrjy

Подписывайтесь на RT в MAX: https://vk.cc/cPWupT";2026-04-20 17:08:00;15;2;1;5903;https://vk.com/wall-40316705_54775337;новости
